<?xml version="1.0" encoding="UTF-8"?>
<xs:schema xmlns:xs="http://www.w3.org/2001/XMLSchema" elementFormDefault="qualified">
  <xs:element name="musicos">
    <xs:complexType>
      <xs:sequence>
        <xs:element name ="musico" minOccurs="1" maxOccurs="unbounded">
          <xs:complexType>
            <xs:sequence>
              <xs:element name = "nombre" type = "xs:string"/>
              <xs:element name = "fechaNacimiento" type = "xs:string" minOccurs="0" maxOccurs="1"/>
            </xs:sequence>
          </xs:complexType>
          </xs:element>
      </xs:sequence>
    </xs:complexType>
  </xs:element>
</xs:schema>
