<?xml version="1.0" encoding="UTF-8"?>
<musicos xmlns:xsi="http://www.w3.org/2001/XMLSchema-instance" xsi:noNamespaceSchemaLocation="file:///E:/Lenguajes%20de%20Marcas/Git/XML-Esquemas/ejercicio%201/ej_esq_6.xsd">
  <musico>
    <nombre>Antonio Vivaldi</nombre>
    <fechaNacimiento>4 de marzo de 1678</fechaNacimiento>
  </musico>
  <musico>
    <nombre>Johann Sebastian Bach</nombre>
    <fechaNacimiento>21 de marzo de 1685</fechaNacimiento>
  </musico>
  <musico>
    <nombre>John Lennon</nombre>
  </musico>
</musicos>
